{
  "$schema": "https://json-schema.org/draft/2020-12/schema",
  "title": "Wallpaper Metadata",
  "type": "object",
  "required": [
    "id",
    "source",
    "title",
    "artist",
    "date",
    "license",
    "image",
    "image_url"
  ],
  "properties": {
    "id": {
      "type": "string",
      "description": "Original source identifier for the artwork (e.g. museum object ID)."
    },
    "source": {
      "type": "string",
      "description": "Institution or collection shorthand (e.g. met, cma, smithsonian)."
    },
    "title": {
      "type": "string",
      "description": "Artwork title."
    },
    "artist": {
      "type": "string",
      "description": "Primary artist name or 'Unknown'."
    },
    "date": {
      "type": "string",
      "description": "Artwork date or period as supplied by the source institution."
    },
    "license": {
      "type": "string",
      "enum": [
        "CC0",
        "Public Domain"
      ],
      "description": "License statement confirming open access use."
    },
    "image": {
      "type": "string",
      "description": "Relative path within the package to the optimized wallpaper image."
    },
    "image_url": {
      "type": "string",
      "format": "uri",
      "description": "Source institution's original image URL."
    },
    "attribution": {
      "type": "string",
      "description": "Optional human-readable attribution or credit line."
    },
    "notes": {
      "type": "string",
      "description": "Optional curation notes, processing details, or caveats."
    }
  },
  "additionalProperties": false
}
