[
  {
    "id": "436535",
    "source": "met",
    "title": "The Great Wave off Kanagawa",
    "artist": "Katsushika Hokusai",
    "date": "ca. 1830â€“32",
    "license": "Public Domain",
    "image": "images/met-436535-great-wave-4k.jpg",
    "image_url": "https://www.metmuseum.org/art/collection/search/436535",
    "attribution": "The Metropolitan Museum of Art",
    "notes": "Example metadata only; replace with optimized assets before publishing."
  }
]
